{
  "counts": {
    "deletedRecords": 1,
    "diagnostics": 0,
    "identityClaims": 1,
    "pendingCreates": 0,
    "relations": 1,
    "reviewOrdinals": 0
  },
  "deletedRecords": [
    {
      "deleteOpId": "l_cccccccccccccccccccccccccccccccccccccccccccccccccccccccccccccccc",
      "deleteSource": "user",
      "deletedAt": "2026-06-02T10:00:00.000Z",
      "legacyRecordDigest": "dddddddddddddddddddddddddddddddddddddddddddddddddddddddddddddddd",
      "memoId": "20260602-090000-02",
      "payload": {
        "byteLength": 248,
        "path": "v2/state/deleted/20260602-090000-02/l_cccccccccccccccccccccccccccccccccccccccccccccccccccccccccccccccc.json",
        "sha256": "eeeeeeeeeeeeeeeeeeeeeeeeeeeeeeeeeeeeeeeeeeeeeeeeeeeeeeeeeeeeeeee"
      }
    }
  ],
  "diagnostics": [],
  "identityClaims": [
    {
      "evidence": {
        "contentHash": "fnv1a-12345678",
        "existingBlockId": "keep-me",
        "lastKnownBlockHash": "fnv1a-87654321",
        "lineNumberHint": 5,
        "logicalDate": "2026-06-01",
        "section": "## Memos",
        "sourcePath": "Daily/2026-06-01.md",
        "time": "08:30:00"
      },
      "legacyRecordDigest": "bbbbbbbbbbbbbbbbbbbbbbbbbbbbbbbbbbbbbbbbbbbbbbbbbbbbbbbbbbbbbbbb",
      "legacyStatus": "active",
      "memoId": "20260601-083000-01"
    }
  ],
  "importerVersion": 1,
  "kind": "knomo.catalog-v2.migration-package",
  "pendingCreates": [],
  "relations": [
    {
      "legacyRecordDigest": "bbbbbbbbbbbbbbbbbbbbbbbbbbbbbbbbbbbbbbbbbbbbbbbbbbbbbbbbbbbbbbbb",
      "memoId": "20260601-083000-01",
      "sourceMemoId": "20260531-220000-01"
    }
  ],
  "reviews": [],
  "schemaVersion": 1,
  "source": {
    "artifactDigest": "aaaaaaaaaaaaaaaaaaaaaaaaaaaaaaaaaaaaaaaaaaaaaaaaaaaaaaaaaaaaaaaa",
    "artifactKind": "memo_index",
    "byteLength": 4096,
    "legacySchemaVersion": 2,
    "period": "2026-06",
    "recordCount": 2
  }
}
